Sheet: nixiedisp
A1: Reference | B1: Quantity | C1: Description | D1: Footprint | E1: Mouser ID | F1: Unit price | G1: Cost
A2: BT1 | B2: 1 | C2: CR2032 battery holder | D2: SMD battery holder Keystone 1060 | E2: 534-1060TR | F2: 1.38 | G2: of:=[.F2]*[.B2] -> 1.38
A3: C3 C5 C6 C7 C9 C10 C13 C14 C17 C18 C21 C24 C27 C30 C33 | B3: 15 | C3: 0.1uF | D3: SMD 0805 | E3: 581-08055C104K | F3: 0.034 | G3: of:=[.F3]*[.B3] -> 0.51
A4: C11 C12 | B4: 2 | C4: 22pF | D4: SMD 0805 | E4: 80-C0805C220K1HACTU | F4: 0.032 | G4: of:=[.F4]*[.B4] -> 0.064
A5: C16 | B5: 1 | C5: 2.2nF | D5: SMD 0805 | E5: 187-CL21B222JBANNNC | F5: 0.02 | G5: of:=[.F5]*[.B5] -> 0.02
A6: C1 C2 C4 C8 C15 | B6: 5 | C6: 1uF electrolytic (RS232 option) | D6: SMD electrolytic 4x5.4 | E6: 710-865060640001 | F6: 0.136 | G6: of:=[.F6]*[.B6] -> 0.68
A7: C35 C36 | B7: 2 | C7: 0.33uF electrolytic | D7: SMD electrolytic 4x5.4 | E7: 710-865230640003 | F7: 0.152 | G7: of:=[.F7]*[.B7] -> 0.304
A8: C37 | B8: 1 | C8: 220uF low-ESR electrolytic | D8: SMD electrolytic 8x10 | E8: 667-EEE-FP1V221AL | F8: 0.526 | G8: of:=[.F8]*[.B8] -> 0.526
A9: C38 | B9: 1 | C9: 10nF | D9: SMD 0805 | E9: 187-CL21B103JBANNNC | F9: 0.02 | G9: of:=[.F9]*[.B9] -> 0.02
A10: C39 | B10: 1 | C10: 2.2uF 250V | D10: Through-hole radial | E10: 647-UVR2E2R2MED1TD | F10: 0.22 | G10: of:=[.F10]*[.B10] -> 0.22
A11: D1 | B11: 1 | C11: 1N4148 | D11: SMD SOD-323 (0805) | E11: 750-1N4148WS-HF | F11: 0.106 | G11: of:=[.F11]*[.B11] -> 0.106
A12: D2 | B12: 1 | C12: MUR160 | D12: SMD DO-214A (SMB) | E12: 821-MUR160SR5G | F12: 0.25 | G12: of:=[.F12]*[.B12] -> 0.25
A13: J1 | B13: 1 | C13: DB9 male (RS232 option) | D13: Through-hole DB9 male | E13: 523-L717SDE09P1ACH | F13: 1.35 | G13: of:=[.F13]*[.B13] -> 1.35
A14: J2 | B14: 1 | C14: Micro-USB connector | D14: USB Micro-B Molex-105017-0001 | E14: 538-105017-0001 | F14: 0.703 | G14: of:=[.F14]*[.B14] -> 0.703
A15: J3 | B15: 1 | C15: AVR programming connector | D15: 2x3 male pin header 2.54mm pitch | E15: 710-61200621621 | F15: 0.381 | G15: of:=[.F15]*[.B15] -> 0.381
A16: J4 | B16: 1 | C16: DC barrel jack | D16: barrel jack 2mm center pin | E16: 490-PJ-202A | F16: 0.5 | G16: of:=[.F16]*[.B16] -> 0.5
A17: J5 | B17: 1 | C17: Hour-separator LED connector | D17: 1x3 female socket 2.54mm pitch | E17: 538-90147-1103 | F17: 0.93 | G17: of:=[.F17]*[.B17] -> 0.93
A18: J6 | B18: 1 | C18: pwr sw | D18: 1x2 male pin header 2.54mm pitch | E18: 538-22-28-4112 | F18: 0.398 | G18: of:=[.F18]*[.B18] -> 0.398
A19: L1 | B19: 1 | C19: 220uH | D19: SMD inductor 14x18.3 | E19: 652-SDR1806-221KL | F19: 0.813 | G19: of:=[.F19]*[.B19] -> 0.813
A20: Q1 Q2 | B20: 2 | C20: MMBTA55 PNP transistor | D20: SMD SOT-23 | E20: 863-MMBTA55LT1G | F20: 0.152 | G20: of:=[.F20]*[.B20] -> 0.304
A21: Q3-Q68 | B21: 66 | C21: MMBTA42 NPN transistor | D21: SMD SOT-23 | E21: 863-MMBTA42LT1G | F21: 0.054 | G21: of:=[.F21]*[.B21] -> 3.564
A22: Q69 | B22: 1 | C22: IRF740A | D22: SMD TO-263-3 | E22: 844-IRF740ASPBF | F22: 1.7 | G22: of:=[.F22]*[.B22] -> 1.7
A23: R1 R2 R27 | B23: 4 | C23: 10k | D23: SMD 0805 | E23: 71-CRCW080510K0JNEAC | F23: 0.033 | G23: of:=[.F23]*[.B23] -> 0.132
A24: R15-R20 R22-R26 R28-R33 R35-R39 R41-R46 R48-R52 R54-R59 R61-R65 R67-R72 R74-R78 R80-R85 R87-R91 | B24: 66 | C24: 47k | D24: SMD 0805 | E24: 652-CR0805FX-4702ELF | F24: 0.007 | G24: of:=[.F24]*[.B24] -> 0.462
A25: R21 R34 R47 R60 R73 R86 | B25: 6 | C25: 160k | D25: SMD 0805 | E25: 660-RK73H2ATTD1603F | F25: 0.013 | G25: of:=[.F25]*[.B25] -> 0.078
A26: R3 R4 R7 | B26: 3 | C26: 1 ohm | D26: SMD 0805 | E26: 603-RC0805FR-071RL | F26: 0.044 | G26: of:=[.F26]*[.B26] -> 0.132
A27: R5 R6 R8 | B27: 2 | C27: 1k | D27: SMD 0805 | E27: 71-CRCW08051K00JNEAC | F27: 0.033 | G27: of:=[.F27]*[.B27] -> 0.066
A28: R9 R10 R11 R12 R13 R14 | B28: 6 | C28: 24k | D28: SMD 0805 | E28: 660-RK73H2ATTD2402F | F28: 0.014 | G28: of:=[.F28]*[.B28] -> 0.084
A29: R93 | B29: 1 | C29: 475K | D29: SMD 0805 | E29: 667-ERJ-6ENF4753V | F29: 0.055 | G29: of:=[.F29]*[.B29] -> 0.055
A30: R94 | B30: 1 | C30: 3K32 | D30: SMD 0805 | E30: 71-CRCW0805-3.32K-E3 | F30: 0.048 | G30: of:=[.F30]*[.B30] -> 0.048
A31: SW1-SW3 | B31: 1 | C31: Right-angle tactile button | D31: SMD right-angle | E31: 113-TA34W2VTR | F31: 1.36 | G31: of:=[.F31]*[.B31] -> 1.36
A32: U1 | B32: 1 | C32: Atmega328PB-AU | D32: TQFP-32 | E32: 556-ATMEGA328PB-AU | F32: 1.13 | G32: of:=[.F32]*[.B32] -> 1.13
A33: U14 U15 U16 U17 U18 U19 | B33: 6 | C33: 74HC4514 | D33: SOIC-24 wide | E33: 771-74HC4514D-T | F33: 0.864 | G33: of:=[.F33]*[.B33] -> 5.184
A34: U2 | B34: 1 | C34: MAX232 (RS232 option) | D34: SOIC-16 | E34: 595-MAX232DR | F34: 0.737 | G34: of:=[.F34]*[.B34] -> 0.737
A35: U3 | B35: 1 | C35: 74HC126 | D35: SOIC-14 | E35: 595-SN74HC126DR | F35: 0.237 | G35: of:=[.F35]*[.B35] -> 0.237
A36: U32 | B36: 1 | C36: DS1302Z+ | D36: SOIC-8 | E36: 700-DS1302ZT&R | F36: 2.79 | G36: of:=[.F36]*[.B36] -> 2.79
A37: U33 | B37: 1 | C37: MC34063AD | D37: SOIC-8 | E37: 595-MC34063ADR | F37: 0.296 | G37: of:=[.F37]*[.B37] -> 0.296
A38: U34 | B38: 1 | C38: 7805 | D38: SMD TO-252-2 DPAK | E38: 863-MC7805CDTRKG | F38: 0.356 | G38: of:=[.F38]*[.B38] -> 0.356
A39: U4 | B39: 1 | C39: MCP2221AxSL | D39: SOIC-14 | E39: 579-MCP2221A-I/SL | F39: 1.68 | G39: of:=[.F39]*[.B39] -> 1.68
A40: U5 U6 U7 | B40: 3 | C40: 74HC164 | D40: SOIC-14 | E40: 771-74HC164D-T | F40: 0.22 | G40: of:=[.F40]*[.B40] -> 0.66
A41: U8 U9 U10 U11 U12 U13 | B41: 6 | C41: IN14 | D41: Nixie tube IN-14 | G41: of:=[.F41]*[.B41] -> 0
A42: Y1 | B42: 1 | C42: 14.7456MHz | D42: SMD crystal ECS CSM3X 2pin 7.6x4.1mm | E42: 815-ABLS7M-14.745B2T | F42: 0.288 | G42: of:=[.F42]*[.B42] -> 0.288
A43: Y2 | B43: 1 | C43: 32.768KHz | D43: SMD crystal 2-pin 2x1.2mm (alt.footprint Y3) | E43: 815-ABS0632768KHZ61T | G43: of:=[.F43]*[.B43] -> 0
A44: Y3 | B44: 1 | C44: 32.768KHz | D44: Through-hole crystal 3x8mm (alt.footprint Y2) | E44: 695-CFS-20632768EZBB | F44: 0.347 | G44: of:=[.F44]*[.B44] -> 0.347
B45: 2 | C45: Amber 3mm LED (hour sep.) | D45: Through-hole 3mm LED | E45: 859-LTL-1CHA | F45: 0.144 | G45: of:=[.F45]*[.B45] -> 0.288
F47: Total cost: | G47: of:=SUM([.G2:.G45]) -> 31.133